{
  "$schema": "https://json-schema.org/draft/2020-12/schema",
  "additionalProperties": false,
  "properties": {
    "as_of": {
      "format": "date",
      "type": "string"
    },
    "feature": {
      "minLength": 1,
      "type": "string"
    },
    "series_id": {
      "minLength": 1,
      "type": "string"
    },
    "source_snapshot_id": {
      "minLength": 1,
      "type": "string"
    },
    "value": {
      "type": "number"
    }
  },
  "required": [
    "series_id",
    "as_of",
    "feature",
    "value",
    "source_snapshot_id"
  ],
  "title": "MinimalRiskMetricInputRow",
  "type": "object"
}

