[
  {
    "as_of": "2026-06-25",
    "feature": "nav_return_1d",
    "series_id": "FUND_A",
    "source_snapshot_id": "raw_nav_20260625",
    "value": 0.00125
  },
  {
    "as_of": "2026-06-25",
    "feature": "active_share_proxy",
    "series_id": "FUND_A",
    "source_snapshot_id": "holdings_20260625",
    "value": 0.42
  }
]

